{
  "$schema": "https://json-schema.org/draft/2020-12/schema",
  "$id": "https://jeongjae.github.io/SP-FR-guidebook/daily-card.schema.json",
  "title": "SP-FR Daily Action Map",
  "type": "object",
  "required": [
    "schemaVersion",
    "day",
    "date",
    "city",
    "title",
    "sourceStatus",
    "startTime",
    "endTime",
    "totalDuration",
    "totalDistance",
    "fatigue",
    "hotel",
    "stops",
    "legs",
    "transport",
    "food",
    "highlights",
    "backup",
    "needsReview",
    "sourceRefs"
  ],
  "properties": {
    "schemaVersion": {
      "const": "1.0"
    },
    "day": {
      "type": "integer",
      "minimum": 1,
      "maximum": 43
    },
    "date": {
      "type": "string",
      "format": "date"
    },
    "city": {
      "type": "string",
      "minLength": 1
    },
    "title": {
      "type": "string",
      "minLength": 1
    },
    "sourceStatus": {
      "enum": [
        "authoritative",
        "candidate-latest-needs-review",
        "prototype-reviewed"
      ]
    },
    "prototypeType": {
      "type": [
        "string",
        "null"
      ],
      "enum": [
        null,
        "urban",
        "car-loop",
        "intercity"
      ]
    },
    "dayType": {
      "type": [
        "string",
        "null"
      ],
      "enum": [
        null,
        "city",
        "transfer",
        "driving",
        "living"
      ],
      "description": "현장 실행 화면 유형. Pilot Day부터 선택적으로 적용한다."
    },
    "startTime": {
      "type": [
        "string",
        "null"
      ],
      "pattern": "^([01]\\d|2[0-3]):[0-5]\\d$"
    },
    "endTime": {
      "type": [
        "string",
        "null"
      ],
      "pattern": "^([01]\\d|2[0-3]):[0-5]\\d$"
    },
    "totalDuration": {
      "type": [
        "string",
        "null"
      ]
    },
    "totalDistance": {
      "type": [
        "string",
        "null"
      ]
    },
    "fatigue": {
      "type": "string",
      "pattern": "^[1-5](?:[–~\\-/][1-5])?$"
    },
    "hotel": {
      "$ref": "#/$defs/place"
    },
    "stops": {
      "type": "array",
      "minItems": 1,
      "maxItems": 9,
      "items": {
        "$ref": "#/$defs/stop"
      }
    },
    "legs": {
      "type": "array",
      "items": {
        "$ref": "#/$defs/leg"
      }
    },
    "transport": {
      "type": "array",
      "items": {
        "type": "string"
      }
    },
    "food": {
      "type": "array",
      "items": {
        "type": "string"
      }
    },
    "highlights": {
      "type": "array",
      "items": {
        "type": "string"
      },
      "maxItems": 4
    },
    "backup": {
      "type": [
        "string",
        "null"
      ]
    },
    "map": {
      "type": [
        "object",
        "null"
      ],
      "properties": {
        "zoom": {
          "type": "integer",
          "minimum": 1,
          "maximum": 18
        },
        "center": {
          "type": "array",
          "minItems": 2,
          "maxItems": 2,
          "items": {
            "type": "number"
          }
        },
        "routeCache": {
          "type": [
            "string",
            "null"
          ]
        }
      },
      "required": [
        "zoom",
        "center",
        "routeCache"
      ],
      "additionalProperties": false
    },
    "needsReview": {
      "type": "array",
      "items": {
        "type": "string"
      }
    },
    "sourceRefs": {
      "type": "array",
      "items": {
        "type": "string"
      },
      "minItems": 1
    }
  },
  "$defs": {
    "place": {
      "type": "object",
      "required": [
        "name",
        "lat",
        "lng",
        "status"
      ],
      "properties": {
        "name": {
          "type": [
            "string",
            "null"
          ]
        },
        "lat": {
          "type": [
            "number",
            "null"
          ],
          "minimum": -90,
          "maximum": 90
        },
        "lng": {
          "type": [
            "number",
            "null"
          ],
          "minimum": -180,
          "maximum": 180
        },
        "status": {
          "enum": [
            "confirmed",
            "candidate",
            "private-approximate",
            "needs-review"
          ]
        },
        "address": {
          "type": [
            "string",
            "null"
          ],
          "description": "검증된 좌표가 없을 때 지도를 여는 근거. 주소는 확정, 좌표는 미확인인 경우가 있다."
        }
      },
      "additionalProperties": false
    },
    "stop": {
      "type": "object",
      "required": [
        "id",
        "order",
        "start",
        "end",
        "name",
        "category",
        "lat",
        "lng",
        "summary",
        "menu",
        "reservation",
        "optional"
      ],
      "properties": {
        "id": {
          "type": "string",
          "pattern": "^[a-z0-9-]+$"
        },
        "order": {
          "type": "integer",
          "minimum": 1
        },
        "start": {
          "type": [
            "string",
            "null"
          ]
        },
        "end": {
          "type": [
            "string",
            "null"
          ]
        },
        "name": {
          "type": "string",
          "minLength": 1
        },
        "category": {
          "enum": [
            "sight",
            "culture",
            "food",
            "cafe",
            "shopping",
            "activity",
            "transport",
            "hotel"
          ]
        },
        "lat": {
          "type": [
            "number",
            "null"
          ],
          "minimum": -90,
          "maximum": 90
        },
        "lng": {
          "type": [
            "number",
            "null"
          ],
          "minimum": -180,
          "maximum": 180
        },
        "summary": {
          "type": "string"
        },
        "menu": {
          "type": [
            "string",
            "null"
          ]
        },
        "reservation": {
          "type": [
            "string",
            "null"
          ]
        },
        "executionStatuses": {
          "type": "array",
          "maxItems": 4,
          "items": {
            "$ref": "#/$defs/executionStatus"
          },
          "description": "예약 문자열에 섞여 있던 실행 의미를 내부 상태와 화면 문구로 분리한다."
        },
        "executionNote": {
          "type": [
            "string",
            "null"
          ],
          "description": "상태가 아닌 실행 설명. 예: 자유 입장."
        },
        "officialUrl": {
          "type": [
            "string",
            "null"
          ],
          "format": "uri",
          "description": "Place 페이지가 없는 실행 stop의 공식 사이트 링크."
        },
        "optional": {
          "type": "boolean"
        },
        "place_ref": {
          "type": [
            "string",
            "null"
          ]
        },
        "place_relation": {
          "type": "string",
          "enum": [
            "visit",
            "context",
            "transit",
            "nearby"
          ],
          "description": "visit만 Place→Day 역링크를 만든다. place_ref가 없을 때 context/transit/nearby 의미를 명시할 수 있다."
        },
        "related_place_refs": {
          "type": "array",
          "items": {
            "type": "string",
            "minLength": 1
          },
          "uniqueItems": true,
          "description": "일정 stop에서 함께 열어보는 정본 Place 참조. 방문지·시각 의미를 바꾸지 않는 부가 링크다."
        },
        "fieldEdit": {
          "type": "boolean",
          "description": "현장 웹앱이 추가한 스톱 — 확정 사실·장소 연결 가드에서 면제되는 표식"
        }
      },
      "additionalProperties": false
    },
    "executionStatus": {
      "type": "object",
      "required": [
        "type",
        "detail"
      ],
      "properties": {
        "type": {
          "enum": [
            "confirmed",
            "book",
            "ticket",
            "check",
            "caution",
            "optional",
            "unavailable"
          ]
        },
        "detail": {
          "type": "string"
        },
        "label": {
          "type": "string",
          "minLength": 1,
          "maxLength": 30
        }
      },
      "additionalProperties": false
    },
    "leg": {
      "type": "object",
      "required": [
        "from",
        "to",
        "mode",
        "duration",
        "distance",
        "line",
        "geometryStatus"
      ],
      "properties": {
        "from": {
          "type": "string"
        },
        "to": {
          "type": "string"
        },
        "mode": {
          "enum": [
            "walk",
            "metro",
            "train",
            "car",
            "bus",
            "tram",
            "funicular",
            "taxi",
            "flight",
            "unconfirmed"
          ]
        },
        "duration": {
          "type": [
            "string",
            "null"
          ]
        },
        "distance": {
          "type": [
            "string",
            "null"
          ]
        },
        "line": {
          "type": [
            "string",
            "null"
          ]
        },
        "geometryStatus": {
          "enum": [
            "verified-cache",
            "coordinate-line",
            "needs-review"
          ]
        }
      },
      "additionalProperties": false
    }
  },
  "additionalProperties": false
}
