{"schemaVersion":"1.0","day":3,"date":"2026-08-31","city":"Barcelona","title":"책과 도시의 기억 — 고딕지구·도서관·MACBA","sourceStatus":"authoritative","prototypeType":null,"dayType":"city","startTime":"09:00","endTime":"21:00","totalDuration":"12시간","totalDistance":"약 6.5km · 도보+메트로","fatigue":"3","hotel":{"name":"Occidental Barcelona 1929","lat":41.3752738,"lng":2.1476619,"status":"confirmed","address":"Carrer de la Creu Coberta 20-22, Sants-Montjuïc, 08014 Barcelona, Spain"},"stops":[{"id":"mercat-concepcio","order":1,"start":"09:30","end":"10:30","name":"Mercat de la Concepció 아침 장보기","category":"shopping","lat":41.3965,"lng":2.1695,"summary":"1888년 철골 구조의 꽃·식품 시장. 아침 로컬 분위기와 신선 과일 관찰","menu":null,"reservation":null,"optional":false,"place_ref":"mercat-concepcio"},{"id":"barri-gotic","order":2,"start":"11:00","end":"12:30","name":"고딕지구 핵심 산책","category":"sight","lat":41.3833,"lng":2.1764,"summary":"바르셀로나 대성당, Plaça del Rei, Plaça Sant Jaume, 비숍스 브리지로 이어지는 역사 도보 (90분 통합 블록)","menu":null,"reservation":null,"optional":false,"place_ref":"barri-gotic"},{"id":"biblioteca-de-catalunya","order":3,"start":"12:40","end":"13:30","name":"Biblioteca de Catalunya","category":"culture","lat":41.3811,"lng":2.1702,"summary":"옛 산타 크레우 병원 고딕 볼트와 중정 회랑. 카탈루냐 인문 정신의 거점","menu":null,"reservation":null,"optional":false,"executionStatuses":[{"type":"check","label":"CHECK","detail":"일반 방문 접근 범위는 현장 확인"}],"executionNote":"월–금 09:00–20:00 · 예약 없음 · 운영시간 내 방문 가능","place_ref":"biblioteca-de-catalunya"},{"id":"bar-canete","order":4,"start":"13:45","end":"15:00","name":"Bar Cañete 점심","category":"food","lat":41.3789,"lng":2.1741,"summary":"라발 지구 정통 카운터 타파스 바. 월요일 영업 · 공식 주방 운영 13:00–24:00","menu":"소꼬리 샌드위치, 풋고추 튀김(Pimientos de Padrón), 신선 해산물","reservation":null,"optional":false,"executionStatuses":[{"type":"book","label":"BOOK","detail":"13:30 전후 사전 예약 필요 · 아직 예약 완료 아님"},{"type":"check","label":"CHECK","detail":"실제 예약 확정시각 출발 전 확인"}],"place_ref":"bar-canete"},{"id":"macba","order":5,"start":"15:15","end":"17:15","name":"MACBA","category":"culture","lat":41.3832,"lng":2.1669,"summary":"리처드 마이어 설계의 백색 공간과 현대미술 기획전. 하계 월요일 10:00–20:00","menu":null,"reservation":null,"optional":false,"executionStatuses":[{"type":"ticket","label":"TICKET","detail":"온라인 예매 €13.50 권장 · 현장 일반권 €15"},{"type":"check","label":"CHECK","detail":"전시실 운영 상태 출발 전 재확인"}],"place_ref":"macba"},{"id":"llibreria-finestres","order":6,"start":"17:35","end":"18:30","name":"Llibreria Finestres","category":"shopping","lat":41.3912,"lng":2.1623,"summary":"에이샴플라의 인문학 큐레이션 서점. 피로 시 생략 가능","menu":null,"reservation":null,"optional":true,"executionStatuses":[{"type":"optional","label":"OPTIONAL","detail":"피로 시 먼저 생략"}],"place_ref":null},{"id":"barcelona-stay-return","order":7,"start":"19:00","end":"21:00","name":"숙소 귀환 — 짐 정리 및 휴식","category":"hotel","lat":41.375274,"lng":2.147662,"summary":"익일 렌터카 인수 및 체크아웃 패킹 준비","menu":null,"reservation":null,"optional":false,"place_ref":null}],"legs":[{"from":"mercat-concepcio","to":"barri-gotic","mode":"walk","duration":"20분","distance":"1.5km","line":null,"geometryStatus":"coordinate-line"},{"from":"barri-gotic","to":"biblioteca-de-catalunya","mode":"walk","duration":"10분","distance":"0.6km","line":null,"geometryStatus":"coordinate-line"},{"from":"biblioteca-de-catalunya","to":"bar-canete","mode":"walk","duration":"15분","distance":"0.4km","line":null,"geometryStatus":"coordinate-line"},{"from":"bar-canete","to":"macba","mode":"walk","duration":"35분 (라발 산책·커피 포함)","distance":"0.7km","line":null,"geometryStatus":"coordinate-line"},{"from":"macba","to":"llibreria-finestres","mode":"walk","duration":"20분","distance":"0.7km","line":null,"geometryStatus":"coordinate-line"},{"from":"llibreria-finestres","to":"barcelona-stay-return","mode":"walk","duration":"30분 또는 Metro","distance":"약 2.1km","line":null,"geometryStatus":"coordinate-line"}],"transport":["도보 (각 구간이 짧다)"],"food":["Bar Cañete · 타파스·해산물","시장 장보기 · 과일·빵"],"highlights":["07:20 러닝/수영 선택","월요일 개관 MACBA","책방 뒤에는 반드시 숙소로"],"backup":"월요일 휴관 대비 완료. 피로 시 Finestres 삭제, Biblioteca·MACBA 중심","map":{"zoom":14,"center":[41.3865,2.161],"routeCache":null},"needsReview":["확정 숙소(Hostafrancs) 기준 Concepció 시장 아침 동선 재검토 — 챕터 시간표는 구 후보 기준","예약번호·총액·무료취소 기한 기록 (챕터 pending 배지)"],"sourceRefs":["source/CURRENT/20_Regional_Chapters/04_Barcelona_Sitges_v2.0.md#Day-3","source/ASSETS/76_Daily_Execution_Maps/daily-maps.json#2026-08-31","source/ASSETS/75_Execution_Maps/Barcelona_Execution_Map_v0.2.kml","OSM Nominatim 지오코딩 2026-08-05: Bar Cañete·Llibreria Finestres·Mercat de la Concepció"]}
