{"schemaVersion":"1.0","day":21,"date":"2026-09-18","city":"Avignon","title":"Arles 철도 당일치기","sourceStatus":"authoritative","prototypeType":null,"dayType":"transfer","startTime":"08:30","endTime":"20:30","totalDuration":"12시간","totalDistance":"TER 철도 왕복 + 아를 시내 도보 약 4.5km","fatigue":"3","hotel":{"name":"Avignon 숙소 — Rue d'Annanelle","lat":43.9472485,"lng":4.8021506,"status":"confirmed","address":"10 Rue d'Annanelle, 84000 Avignon, France"},"stops":[{"id":"avignon-centre","order":1,"start":"08:30","end":"09:15","name":"Avignon Centre역 ➔ Arles 이동 (TER)","category":"transport","lat":43.9422,"lng":4.8058,"summary":"숙소에서 Avignon Centre역으로 도보 이동해 Arles행 직통 TER를 이용한다. 공식 노선은 다수 운행하고 최단 약 16–17분이지만, 특정 열차 시각은 출발 전 SNCF Connect에서 확인한다. 차량은 9/17 반납 완료 상태다.","menu":null,"reservation":null,"executionStatuses":[{"type":"check","label":"LIVE TRAIN CHECK","detail":"08:45편을 확정값으로 보지 말고 출발 전 SNCF Connect에서 실제 금요일 열차와 승강장을 확인한다."}],"executionNote":"Action Card 목적지는 Gare d'Avignon Centre → Gare d'Arles.","officialUrl":"https://www.sncf-connect.com/train/horaires/avignon/arles","optional":false,"place_ref":null},{"id":"arenes","order":2,"start":"09:20","end":"10:45","name":"Arènes d'Arles (아를 원형경기장)","category":"sight","lat":43.6778,"lng":4.6311,"summary":"기원후 90년 로마 원형경기장. 2층 아케이드와 중세 방어탑 전망대에서 론 강과 아를 구시가지 파노라마 조망","menu":null,"reservation":"현장 발권 / 유적 패스","executionStatuses":[{"type":"ticket","label":"TICKET","detail":"내부관람은 현장권 또는 Arles monuments pass가 필요하다."}],"officialUrl":"https://www.arlestourisme.com/","optional":false,"place_ref":"arenes-d-arles"},{"id":"theatre","order":3,"start":"10:45","end":"11:45","name":"Théâtre Antique & 공화국 광장","category":"sight","lat":43.6767,"lng":4.6297,"summary":"기원전 1세기 아우구스투스 황제 시기 고대극장 회랑 기둥 및 오벨리스크가 서 있는 Place de la République","menu":null,"reservation":null,"executionStatuses":[{"type":"ticket","label":"TICKET","detail":"Théâtre Antique 내부관람 시 입장권이 필요하다."}],"optional":false,"place_ref":"theatre-antique-arles"},{"id":"forum-lunch","order":4,"start":"11:45","end":"13:15","name":"Le Gibolin 점심 (아를 로케트 지구)","category":"food","lat":43.6764,"lng":4.6267,"summary":"반 고흐의 '밤의 카페 테라스' 배경지인 포룸 광장 인근 로케트 지구 레스토랑에서 카마르그식 점심 식사","menu":"카마르그 황소 스튜(Gardianne de taureau), 카마르그 적미 밥","reservation":null,"executionStatuses":[{"type":"check","label":"LUNCH CHECK","detail":"금요일 영업과 점심 주문 마감·브레이크타임을 당일 확인한다."}],"optional":false,"place_ref":"le-gibolin-arles"},{"id":"saint-trophime","order":5,"start":"13:30","end":"14:45","name":"Cloître Saint-Trophime (생트로핌 회랑)","category":"culture","lat":43.6764,"lng":4.6283,"summary":"12-14세기 로마네스크와 고딕 조각의 정수가 보존된 생트로핌 대성당 회랑","menu":null,"reservation":null,"executionStatuses":[{"type":"ticket","label":"TICKET","detail":"회랑 내부관람은 입장권이 필요하다."}],"executionNote":"공식 2026년 5–9월 일반 운영은 매일 09:00–19:00. 행사 변동은 당일 확인한다.","officialUrl":"https://www.arlestourisme.com/fr/d%C3%A9tails.html?=Clo%C3%AEtre+Saint+Trophime&ident=5538418","optional":false,"place_ref":"cloitre-saint-trophime"},{"id":"la-roquette","order":6,"start":"15:00","end":"16:30","name":"La Roquette 구시가지 & 론 강변","category":"sight","lat":43.675,"lng":4.6231,"summary":"옛 어부들의 거주지 라 로케트의 조용한 석조 골목 및 론 강변(반 고흐 '론 강의 별이 빛나는 밤' 배경지) 산책","menu":null,"reservation":null,"executionStatuses":[{"type":"optional","label":"OPTIONAL","detail":"피로·우천 시 가장 먼저 생략하고 역으로 이동한다."}],"optional":true,"place_ref":"la-roquette"},{"id":"avignon-return","order":7,"start":"17:00","end":"20:30","name":"Arles ➔ Avignon 귀환 & 저녁","category":"hotel","lat":43.94993,"lng":4.81302,"summary":"Gare d'Arles로 돌아가 Avignon Centre행 TER를 이용한다. 17:15편을 확정값으로 보지 않고 당일 SNCF Connect에서 실제 귀환편·승강장을 확인한다. 아비뇽 도착 후 저녁 식사와 숙소 귀환으로 마무리한다.","menu":null,"reservation":null,"executionStatuses":[{"type":"check","label":"LIVE TRAIN CHECK","detail":"17:15편을 고정하지 말고 오후 일정 중 실제 귀환 TER를 확인한다."}],"officialUrl":"https://www.sncf-connect.com/train/horaires/arles/avignon","optional":false,"place_ref":null}],"legs":[{"from":"avignon-centre","to":"arenes","mode":"train","duration":"TER 17분 + 도보 8분","distance":"약 36km","line":null,"geometryStatus":"coordinate-line"},{"from":"arenes","to":"theatre","mode":"walk","duration":"3분","distance":"0.2km","line":null,"geometryStatus":"coordinate-line"},{"from":"theatre","to":"forum-lunch","mode":"walk","duration":"5분","distance":"0.3km","line":null,"geometryStatus":"coordinate-line"},{"from":"forum-lunch","to":"saint-trophime","mode":"walk","duration":"3분","distance":"0.2km","line":null,"geometryStatus":"coordinate-line"},{"from":"saint-trophime","to":"la-roquette","mode":"walk","duration":"10분","distance":"0.6km","line":null,"geometryStatus":"coordinate-line"},{"from":"la-roquette","to":"avignon-return","mode":"train","duration":"도보 12분 + TER 17분","distance":"약 36km","line":null,"geometryStatus":"coordinate-line"}],"transport":["SNCF TER 기차 왕복 (Avignon Centre ↔ Arles, 특정 편은 당일 CHECK)","아를 시내 도보 (원형경기장 ➔ 고대극장 ➔ 포룸 광장 ➔ 생트로핌 ➔ 라 로케트)"],"food":["Place du Forum / La Roquette 점심","아비뇽 귀환 후 저녁"],"highlights":["Avignon Centre 출발 TER — 당일 CHECK","실내관람은 생트로핌/원형경기장 집중","철도·도보 100% 당일치기"],"backup":"우천·피로 시 La Roquette를 먼저 삭제하고, 추가 축소가 필요하면 Théâtre Antique를 외관으로 전환해 확인한 TER로 조기 귀환한다.","map":{"zoom":11,"center":[43.815,4.72],"routeCache":null},"needsReview":["Avignon Centre ↔ Arles 왕복 TER 열차 시간표 확인 (SNCF Connect)","생트로핌 회랑 입장 시간 확인"],"sourceRefs":["source/CURRENT/10_Core/03_Whole_Trip_Master_Itinerary_v1.2.md#Day-21","source/OPERATIONS/100_Whole_Trip_43_Day_Execution_Audit_v1.0.md#Day-21","source/CURRENT/20_Regional_Chapters/09_Avignon_Alpilles_Pont_du_Gard_v2.0.md#Day-21","source/ASSETS/75_Execution_Maps/Avignon_Execution_Map_v0.2.kml","OSM Nominatim 지오코딩 2026-08-06: Avignon Centre역·Arles역","https://www.sncf-connect.com/train/trajet/avignon/arles","https://www.sncf-connect.com/train/trajet/arles/avignon","https://www.arlestourisme.com/fr/d%C3%A9tails.html?=Clo%C3%AEtre+Saint+Trophime&ident=5538418"]}
