{
  "schemaVersion": "1.0",
  "day": 12,
  "date": "2026-09-09",
  "city": "Aix-en-Provence",
  "title": "Nice역 렌터카와 Provence 진입",
  "sourceStatus": "authoritative",
  "prototypeType": null,
  "startTime": "08:00",
  "endTime": null,
  "totalDuration": null,
  "totalDistance": "약 204km · 차량 경로",
  "fatigue": "5",
  "hotel": {
    "name": "Adagio Aix Centre (후보)",
    "lat": 43.528998,
    "lng": 5.440842,
    "status": "candidate"
  },
  "stops": [
    {
      "id": "nice-checkout",
      "order": 1,
      "start": "08:00",
      "end": "08:45",
      "name": "Nice 체크아웃 — Palais ALZIRA",
      "category": "hotel",
      "lat": 43.6996749,
      "lng": 7.2608829,
      "summary": "체크아웃 11:00까지 가능하지만 09:00 렌터카 인수 전에 나온다 — Nice역까지 도보권",
      "menu": null,
      "reservation": "예약완료 — 12 Rue Verdi (체크아웃 11:00)",
      "optional": false
    },
    {
      "id": "nice-station-pickup",
      "order": 2,
      "start": "09:00",
      "end": null,
      "name": "Nice역 렌터카 인수",
      "category": "transport",
      "lat": 43.70499,
      "lng": 7.26199,
      "summary": "Avenue Thiers 영업소 — 숙소에서 도보권, 인수 수속 30–60분",
      "menu": null,
      "reservation": "예약완료 Hertz L672E080313 — 9/9 09:00 인수",
      "optional": false
    },
    {
      "id": "saint-paul",
      "order": 3,
      "start": null,
      "end": null,
      "name": "Saint-Paul-de-Vence",
      "category": "sight",
      "lat": 43.697972,
      "lng": 7.1216304,
      "summary": "Fondation Maeght는 정원·안뜰 중심 — 압박 시 정원만",
      "menu": null,
      "reservation": "Maeght 운영·요금 재확인 (원고 pending)",
      "optional": false
    },
    {
      "id": "grasse",
      "order": 4,
      "start": null,
      "end": null,
      "name": "Grasse 점심·향수",
      "category": "food",
      "lat": 43.6579121,
      "lng": 6.9228664,
      "summary": "향수 가게 한 곳 30–40분 상한, 워크숍(90분+) 금지",
      "menu": "Grasse 점심",
      "reservation": null,
      "optional": true
    },
    {
      "id": "aix-checkin",
      "order": 5,
      "start": null,
      "end": null,
      "name": "Aix 체크인",
      "category": "hotel",
      "lat": 43.528998,
      "lng": 5.440842,
      "summary": "지정주차 진입 — 보행구역 진입 금지, 차량고정·주차카드 확인",
      "menu": null,
      "reservation": "Aix 숙소 후보 확정 필요",
      "optional": false
    },
    {
      "id": "rotonde",
      "order": 6,
      "start": null,
      "end": null,
      "name": "Rotonde·Mirabeau 방향 익히기",
      "category": "sight",
      "lat": 43.5267,
      "lng": 5.44582,
      "summary": "일몰 전 30–45분 — 도착 늦으면 삭제",
      "menu": null,
      "reservation": null,
      "optional": true
    },
    {
      "id": "aix-stay-return",
      "order": 7,
      "start": "19:30",
      "end": null,
      "name": "숙소권 저녁",
      "category": "hotel",
      "lat": 43.528998,
      "lng": 5.440842,
      "summary": "특별식 금지 — A8 운전을 마친 날 Aix 관광을 시작하지 않는다",
      "menu": null,
      "reservation": null,
      "optional": false
    }
  ],
  "legs": [
    {
      "from": "nice-checkout",
      "to": "nice-station-pickup",
      "mode": "walk",
      "duration": "약 15분",
      "distance": "1.2km",
      "line": null,
      "geometryStatus": "coordinate-line"
    },
    {
      "from": "nice-station-pickup",
      "to": "saint-paul",
      "mode": "car",
      "duration": "약 26분",
      "distance": "18.7km",
      "line": null,
      "geometryStatus": "verified-cache"
    },
    {
      "from": "saint-paul",
      "to": "grasse",
      "mode": "car",
      "duration": "약 37분",
      "distance": "22.1km",
      "line": null,
      "geometryStatus": "verified-cache"
    },
    {
      "from": "grasse",
      "to": "aix-checkin",
      "mode": "car",
      "duration": "약 1시간 50분",
      "distance": "162.9km",
      "line": "A8",
      "geometryStatus": "verified-cache"
    },
    {
      "from": "aix-checkin",
      "to": "rotonde",
      "mode": "walk",
      "duration": "7분",
      "distance": "0.5km",
      "line": null,
      "geometryStatus": "coordinate-line"
    },
    {
      "from": "rotonde",
      "to": "aix-stay-return",
      "mode": "walk",
      "duration": "7분",
      "distance": "0.5km",
      "line": null,
      "geometryStatus": "coordinate-line"
    }
  ],
  "transport": [
    "렌터카 — Nice역 09:00 인수 (확정)",
    "A8 고속도로"
  ],
  "food": [
    "Grasse 점심",
    "숙소권 저녁 또는 숙소식"
  ],
  "highlights": [
    "P0 연결일 — 어느 경유지도 늘리지 않는다",
    "09:00 Nice역 인수 (확정)",
    "줄이는 순서: Maeght 내부→마을→Grasse"
  ],
  "backup": "지연 시 Grasse 우선 삭제, Saint-Paul 체류 축소",
  "map": {
    "zoom": 8,
    "center": [
      43.61,
      6.32
    ],
    "routeCache": "routes/day-12-driving-osrm.json"
  },
  "needsReview": [
    "Aix 숙소 후보(Adagio) 승인",
    "Fondation Maeght 운영·요금 재확인",
    "각 경유지 시각은 인수 완료 시각 기준 역산",
    "Nice 숙소 확정 (2026-08-13): 체크아웃 9/9 11:00 — 09:00 렌터카 인수와 순서 확인"
  ],
  "sourceRefs": [
    "source/CURRENT/10_Core/03_Whole_Trip_Master_Itinerary_v1.2.md#Day-12",
    "source/OPERATIONS/100_Whole_Trip_43_Day_Execution_Audit_v1.0.md#Day-12",
    "source/CURRENT/20_Regional_Chapters/07_Aix_en_Provence_v2.0.md#Day-12",
    "source/ASSETS/75_Execution_Maps/Aix_Execution_Map_v0.2.kml",
    "OSM Nominatim 지오코딩 2026-08-06: Saint-Paul·Fondation Maeght·Grasse",
    "예약 확정 (2026-08-09 반영): Hertz L672E080313 — Nice역 9/9 09:00 인수, Avignon TGV 9/20 09:00 반납"
  ]
}
