{"schemaVersion":"1.0","day":25,"date":"2026-09-22","city":"Lyon","title":"Silk & Gastronomy — 일하는 언덕과 먹는 도시","sourceStatus":"authoritative","prototypeType":null,"dayType":"city","startTime":"08:45","endTime":"19:30","totalDuration":"10시간 45분","totalDistance":"메트로 + 도보 약 5.0km","fatigue":"3","hotel":{"name":"Lagrange Aparthotel Lyon Lumière","lat":45.746467,"lng":4.868933,"status":"confirmed","address":"81-85 Cours Albert Thomas, 69003 Lyon, France"},"stops":[{"id":"croix-rousse-market","order":1,"start":"08:45","end":"10:15","name":"Marché de la Croix-Rousse & 마을 산책","category":"shopping","lat":45.7744,"lng":4.8319,"summary":"메트로 C선을 타고 플라토 정상(Croix-Rousse역) 하차 ➔ 대로변(Boulevard de la Croix-Rousse) 화요 대형 로컬 전통 시장(신선 과일, 치즈, 로컬 빵) 탐방 및 Le Mur des Canuts 벽화 외관 산책 (90분)","menu":"에스프레소, 크루아상","reservation":null,"executionStatuses":[{"type":"check","label":"TUESDAY MARKET","detail":"화요일 06:00–13:30 Boulevard de la Croix-Rousse 대형 전통 시장 운영."}],"executionNote":"Metro D (Monplaisir) ➔ Saxe-Gambetta 환승 (Metro B) ➔ Hôtel de Ville 환승 (Metro C) ➔ Croix-Rousse역.","officialUrl":"https://www.lyon-france.com/","optional":false,"place_ref":"croix-rousse"},{"id":"maison-des-canuts","order":2,"start":"10:15","end":"11:50","name":"Maison des Canuts — 자카르 직조기 실제 시연","category":"culture","lat":45.7758,"lng":4.8322,"summary":"10:15~10:45 메종 데 카뉘(10-12 Rue d'Ivry) 도보 이동 및 등록 ➔ 11:00~11:50 19세기 전통 자카르(Jacquard) 수동 직조기 실제 작동 시연 및 비단 직공(Canuts) 역사 해설 가이드 투어 (50분)","menu":null,"reservation":null,"executionStatuses":[{"type":"ticket","label":"GUIDED TOUR","detail":"11:00 자카르 직조 시연 가이드 투어 (€10) · 10:45까지 현장 도착 및 티켓 확인."}],"executionNote":"10-12 Rue d'Ivry, 69004 Lyon (Croix-Rousse역 도보 3분). 화요일 10:00–18:00 개관.","officialUrl":"https://www.maisondescanuts.fr/","optional":false,"place_ref":null,"place_relation":"nearby"},{"id":"halles-gastronomy","order":3,"start":"12:30","end":"14:15","name":"Halles Paul Bocuse 미식 점심","category":"food","lat":45.7622,"lng":4.8519,"summary":"폴 보퀴즈 시장 내 해산물 바에서 신선한 생굴과 샤르도네, 샤퀴테리 테이스팅","menu":"생굴 플래터, 로제트 드 리옹, 생마르슬랭 치즈","reservation":null,"executionStatuses":[{"type":"caution","label":"LUNCH SEATING","detail":"12:30 전후 시장 내 해산물 바(Maison Clessienne 등) 착석 · 점심 피크 시 약간의 대기 고려."}],"executionNote":"Croix-Rousse ➔ TCL C13 버스로 Halles de Lyon Paul Bocuse 정류장 하차 (약 20분 소요).","officialUrl":"https://www.halles-de-lyon-paulbocuse.com/","optional":false,"place_ref":"halles-de-lyon-paul-bocuse"},{"id":"halles-shopping","order":4,"start":"14:15","end":"14:45","name":"폴 보퀴즈 시장 식재료 & 아티장 상점 탐방","category":"shopping","lat":45.7622,"lng":4.8519,"summary":"Mère Richard 생마르슬랭 치즈 명가, Sibilia 소시송 브리오셰 샤퀴테리, Chocolatier Sève 핑크 프랄린 타르트 등 최고 명장(MOF) 부티크 컴팩트 탐방 (30분)","menu":"생마르슬랭 치즈, 프랄린 타르트 포장","reservation":null,"executionStatuses":[],"executionNote":"저녁 숙소식 또는 익일 안시 당일치기용 보존식(치즈·샤퀴테리) 소량 구매.","officialUrl":"https://www.halles-de-lyon-paulbocuse.com/","optional":false,"place_ref":null,"place_relation":"context"},{"id":"tete-dor","order":5,"start":"15:15","end":"17:15","name":"Parc de la Tête d'Or (황금머리 공원)","category":"sight","lat":45.7772,"lng":4.855,"summary":"프랑스 최대 도심 공원. 센트럴 호숫가 산책, 국제 장미원(Roseraie), 19세기 돔형 열대 온실 식물원 산책 및 평화로운 잔디밭 휴식 (2시간)","menu":null,"reservation":null,"executionStatuses":[{"type":"optional","label":"OPTIONAL","detail":"도보 피로 시 체류를 1시간으로 단축하거나 생략하고 16:30 조기 복귀."}],"executionNote":"Halles에서 C4 버스 탑승 ➔ Parc Tête d'Or - Churchill 하차 (10분).","officialUrl":"https://www.lyon.fr/lieu/parcs/parc-de-la-tete-dor","optional":true,"place_ref":"parc-de-la-tete-d-or"},{"id":"lyon-return","order":6,"start":"17:30","end":"19:30","name":"숙소 복귀 & 휴식 (저녁 가볍게)","category":"hotel","lat":45.746467,"lng":4.868933,"summary":"메트로 B+D선으로 숙소(Lagrange Lumière) 복귀. 시장에서 구매한 치즈/과일로 가벼운 저녁 식사 및 익일 Annecy 당일치기 준비","menu":"생마르슬랭 치즈, 바게트, 과일, 차","reservation":null,"executionStatuses":[],"executionNote":"공원 남서쪽에서 C1/C4 버스 또는 Masséna/Charpennes역 ➔ Metro B/D선으로 Monplaisir-Lumière 복귀.","officialUrl":null,"optional":false,"place_ref":null}],"legs":[{"from":"croix-rousse-market","to":"maison-des-canuts","mode":"walk","duration":"5분","distance":"0.3km","line":null,"geometryStatus":"coordinate-line"},{"from":"maison-des-canuts","to":"halles-gastronomy","mode":"bus","duration":"TCL C13 버스 직통 (또는 Metro C ➔ Hôtel de Ville ➔ Bus C3) 약 20~25분 (12:00~12:25 이동 및 착석)","distance":"3.0km","line":null,"geometryStatus":"coordinate-line"},{"from":"halles-gastronomy","to":"halles-shopping","mode":"walk","duration":"시장 내부 이동","distance":"0.1km","line":null,"geometryStatus":"coordinate-line"},{"from":"halles-shopping","to":"tete-dor","mode":"walk","duration":"C4 버스 또는 도보 약 20분","distance":"1.4km","line":null,"geometryStatus":"coordinate-line"},{"from":"tete-dor","to":"lyon-return","mode":"metro","duration":"메트로 B+D선 약 20분","distance":"4.5km","line":null,"geometryStatus":"coordinate-line"}],"transport":["TCL 대중교통 (Metro D ➔ Metro C선 실크 언덕 상행, Croix-Rousse ➔ Bus C13 직통 Halles 이동, Metro B ➔ Metro D 숙소 복귀)","크루아루스 실크 공방 및 테트도르 공원 도보"],"food":["Halles Paul Bocuse 2차 리옹 미식 경험 (12:30~14:15 점심)","저녁은 가볍게 (숙소식 또는 몽플레지르 카페)"],"highlights":["08:45 크루아루스 화요 대형 로컬 시장 탐방","11:00 Maison des Canuts 자카르 직조기 실제 시연 견학","12:30 Les Halles Paul Bocuse 2차 리옹 미식 점심 & 식재료 탐방","15:15 Parc de la Tête d'Or 호숫가 산책 & 17:30 복귀"],"backup":"피로 시 Tête d'Or 공원 체류를 60분으로 단축하고 16:30 조기 복귀하여 휴식","map":{"zoom":13,"center":[45.768,4.842],"routeCache":null},"needsReview":["Maison des Canuts 11:00 직조 시연 가이드 투어 예약 확인 (화요일 9/22 정상 개관)","Les Halles Paul Bocuse 12:30 점심 식당 좌석 확보"],"sourceRefs":["source/CURRENT/10_Core/03_Whole_Trip_Master_Itinerary_v1.2.md#Day-25","source/OPERATIONS/100_Whole_Trip_43_Day_Execution_Audit_v1.0.md#Day-25","source/CURRENT/20_Regional_Chapters/10_Lyon_v2.0.md#Day-25","source/ASSETS/75_Execution_Maps/Lyon_Execution_Map_v0.2.kml"]}
