{
  "schemaVersion": "1.0",
  "day": 9,
  "date": "2026-09-06",
  "city": "Antibes & Cannes",
  "title": "앙티브 요새마을과 칸 당일치기",
  "sourceStatus": "authoritative",
  "prototypeType": null,
  "dayType": "transfer",
  "startTime": "08:15",
  "endTime": "18:00",
  "totalDuration": "9시간 45분",
  "totalDistance": "TER 왕복 + 시내 도보 약 5.5km",
  "fatigue": "3",
  "hotel": {
    "name": "Palais ALZIRA · 12 Rue Verdi",
    "lat": 43.6996749,
    "lng": 7.2608829,
    "status": "confirmed",
    "address": "12 Rue Verdi, Palais ALZIRA, 06000 Nice, France"
  },
  "stops": [
    {
      "id": "nice-ville",
      "order": 1,
      "start": "08:15",
      "end": "08:50",
      "name": "Nice-Ville역 출발 ➔ Antibes 이동",
      "category": "transport",
      "lat": 43.7047,
      "lng": 7.2619,
      "summary": "08:15 숙소 출발, 08:28 전후 TER를 운영 목표로 앙티브 이동. 정확한 출발편은 당일 SNCF Connect에서 확인",
      "menu": null,
      "reservation": null,
      "executionStatuses": [
        {
          "type": "check",
          "label": "당일 확인",
          "detail": "Nice-Ville→Antibes TER 운행·플랫폼을 SNCF Connect에서 확인"
        }
      ],
      "optional": false,
      "place_ref": "nice-ville"
    },
    {
      "id": "antibes-old-town",
      "order": 2,
      "start": "08:50",
      "end": "12:00",
      "name": "Vieil Antibes & Marché Provençal",
      "category": "sight",
      "lat": 43.5811,
      "lng": 7.1264,
      "summary": "앙티브 구시가지 성벽길, 일요일 07:30~13:00 Marché Provençal, Port Vauban 조망. 우천 시 Musée Picasso 실내 관람으로 전환",
      "menu": "프로방스 과일, 올리브, 에스프레소",
      "reservation": null,
      "optional": false,
      "place_ref": null
    },
    {
      "id": "le-figuier-de-saint-esprit",
      "order": 3,
      "start": "12:15",
      "end": "14:00",
      "name": "Le Figuier de Saint-Esprit 점심 (WISH-01)",
      "category": "food",
      "lat": 43.5816,
      "lng": 7.1278,
      "summary": "앙티브 구시가지 성벽 안쪽 미쉐린 1스타 레스토랑. 일요일 점심 주문 시간 12:15~13:30에 맞춘 무화과나무 중정 런치",
      "menu": "시그니처 오징어 먹물 카넬로니, 런치 포뮬러(€55~€75), Menu du Figuier(€118)",
      "reservation": null,
      "executionStatuses": [
        {
          "type": "book",
          "label": "예약 필요",
          "detail": "12:15 희망 슬롯만 확인됨 · 실제 예약 confirmation 없음"
        }
      ],
      "optional": false,
      "place_ref": "le-figuier-de-saint-esprit"
    },
    {
      "id": "cannes-transfer",
      "order": 4,
      "start": "14:10",
      "end": "14:40",
      "name": "Antibes ➔ Cannes TER 이동",
      "category": "transport",
      "lat": 43.5858,
      "lng": 7.1191,
      "summary": "14:15 전후 TER를 운영 목표로 칸 이동. 정확한 출발편과 플랫폼은 당일 확인",
      "menu": null,
      "reservation": null,
      "executionStatuses": [
        {
          "type": "check",
          "label": "당일 확인",
          "detail": "Antibes→Cannes TER 운행·플랫폼을 SNCF Connect에서 확인"
        }
      ],
      "optional": false,
      "place_ref": "cannes"
    },
    {
      "id": "le-suquet",
      "order": 5,
      "start": "14:45",
      "end": "15:45",
      "name": "Le Suquet & 구시가지 언덕",
      "category": "sight",
      "lat": 43.5511,
      "lng": 7.0108,
      "summary": "칸의 옛 어촌 언덕. 자갈 계단길을 올라 성채 광장에서 칸 만과 구항구 파노라마 조망 (60분 compact visit)",
      "menu": null,
      "reservation": null,
      "optional": false,
      "place_ref": "le-suquet"
    },
    {
      "id": "croisette",
      "order": 6,
      "start": "15:50",
      "end": "16:50",
      "name": "Boulevard de la Croisette",
      "category": "sight",
      "lat": 43.5502,
      "lng": 7.0255,
      "summary": "팔레 데 페스티발 외관 및 야자수 해안 산책로. 지중해 벤치 휴식. 피로 시 단축 가능",
      "menu": null,
      "reservation": null,
      "executionStatuses": [
        {
          "type": "optional",
          "label": "선택",
          "detail": "우천·열차 지연 시 1순위 생략"
        }
      ],
      "optional": true,
      "place_ref": null
    },
    {
      "id": "cannes-station",
      "order": 7,
      "start": "16:50",
      "end": "17:35",
      "name": "Gare de Cannes ➔ Nice TER 탑승",
      "category": "transport",
      "lat": 43.5539,
      "lng": 7.0205,
      "summary": "17:00 전후를 운영 목표로 니스행 TER 탑승. 약 30분 소요, 정확한 출발편은 당일 확인",
      "menu": null,
      "reservation": null,
      "executionStatuses": [
        {
          "type": "check",
          "label": "당일 확인",
          "detail": "Cannes→Nice-Ville TER 운행·플랫폼을 SNCF Connect에서 확인"
        }
      ],
      "optional": false,
      "place_ref": "cannes"
    },
    {
      "id": "nice-return",
      "order": 8,
      "start": "17:35",
      "end": "18:00",
      "name": "Nice-Ville 도착 ➔ 숙소 귀환",
      "category": "hotel",
      "lat": 43.7002,
      "lng": 7.2628,
      "summary": "니스역 도착 후 숙소 12 Rue Verdi로 복귀 및 휴식",
      "menu": null,
      "reservation": null,
      "optional": false,
      "place_ref": null
    }
  ],
  "legs": [
    {
      "from": "nice-ville",
      "to": "antibes-old-town",
      "mode": "train",
      "duration": "TER 18분 + 도보 8분",
      "distance": "약 20km",
      "line": null,
      "geometryStatus": "coordinate-line"
    },
    {
      "from": "antibes-old-town",
      "to": "le-figuier-de-saint-esprit",
      "mode": "walk",
      "duration": "5분",
      "distance": "0.3km",
      "line": null,
      "geometryStatus": "coordinate-line"
    },
    {
      "from": "le-figuier-de-saint-esprit",
      "to": "cannes-transfer",
      "mode": "walk",
      "duration": "앙티브역까지 도보 8분",
      "distance": "약 0.6km",
      "line": null,
      "geometryStatus": "coordinate-line"
    },
    {
      "from": "cannes-transfer",
      "to": "le-suquet",
      "mode": "train",
      "duration": "TER 약 12분 + 도보 10분",
      "distance": "약 12.5km",
      "line": "TER Antibes→Cannes",
      "geometryStatus": "coordinate-line"
    },
    {
      "from": "le-suquet",
      "to": "croisette",
      "mode": "walk",
      "duration": "10분",
      "distance": "0.7km",
      "line": null,
      "geometryStatus": "coordinate-line"
    },
    {
      "from": "croisette",
      "to": "cannes-station",
      "mode": "walk",
      "duration": "10분",
      "distance": "0.6km",
      "line": null,
      "geometryStatus": "coordinate-line"
    },
    {
      "from": "cannes-station",
      "to": "nice-return",
      "mode": "train",
      "duration": "TER 약 30분 + 도보 10분",
      "distance": "약 32km",
      "line": null,
      "geometryStatus": "coordinate-line"
    }
  ],
  "transport": [
    "TER 왕복 (Nice-Ville ↔ Antibes ↔ Cannes)",
    "앙티브 및 칸 시내 도보"
  ],
  "food": [
    "점심: Le Figuier de Saint-Esprit (WISH-01, 미쉐린 1스타)"
  ],
  "highlights": [
    "08:15 Nice 출발",
    "08:50~12:00 앙티브 구시가지 & 프로방스 시장",
    "12:15~14:00 Le Figuier de Saint-Esprit 파인다이닝 런치",
    "14:45~16:50 칸 르 쉬케 & 선택 Croisette 후 니스 조기 복귀"
  ],
  "backup": "우천 시 Antibes 성벽·Port Vauban 야외 체류를 줄이고 Musée Picasso(일요일 10:00~18:00)를 60~90분 실내 관람으로 전환. Cannes에서는 Croisette를 먼저 생략하고 Le Suquet만 짧게 본 뒤 조기 귀환. 열차 지연 시에도 Croisette가 1순위 삭제.",
  "map": {
    "zoom": 11,
    "center": [
      43.58,
      7.08
    ],
    "routeCache": null
  },
  "needsReview": [
    "Le Figuier de Saint-Esprit 일요일 12:15 런치 예약 실행 — 현재 confirmation 없음",
    "TER 일요일 운행 간격(15~20분) 당일 SNCF Connect 재확인"
  ],
  "sourceRefs": [
    "source/CURRENT/10_Core/03_Whole_Trip_Master_Itinerary_v1.2.md#Day-9",
    "source/OPERATIONS/100_Whole_Trip_43_Day_Execution_Audit_v1.0.md#Day-9",
    "source/CURRENT/20_Regional_Chapters/06_Nice_Cote_d_Azur_v2.0.md#Day-9",
    "OSM Nominatim 지오코딩 2026-08-06: Antibes·Le Figuier·Suquet·Croisette·칸역"
  ]
}
