{"schemaVersion":"1.0","day":1,"date":"2026-08-29","city":"Barcelona","title":"야간 도착과 체크인","sourceStatus":"authoritative","prototypeType":null,"dayType":"transfer","startTime":"19:10","endTime":"23:00","totalDuration":"3시간 50분","totalDistance":"Aerobús A1 약 25~35분 · Plaça Espanya에서 도보","fatigue":"3","hotel":{"name":"Occidental Barcelona 1929","lat":41.3752738,"lng":2.1476619,"status":"confirmed","address":"Carrer de la Creu Coberta 20-22, Sants-Montjuïc, 08014 Barcelona, Spain"},"stops":[{"id":"bcn-airport","order":1,"start":"19:10","end":"20:40","name":"BCN T1 도착 — OZ511","category":"transport","lat":41.296944,"lng":2.079047,"summary":"19:10 착륙 후 입국심사·수하물 수령. T1 도착층(Floor 0) 외부 Aerobús A1 승강장으로 이동하여 Plaça d'Espanya행 탑승 (25~35분 소요, 1인 €7.75 모바일 QR/비접촉 카드). 하차 후 Carrer de la Creu Coberta 방향 평지 도보 200m(약 3~5분) 숙소 진입","menu":null,"reservation":null,"optional":false,"executionStatuses":[{"type":"confirmed","label":"CONFIRMED","detail":"OZ511 · ICN T2 11:50 → BCN T1 19:10 · 무료 수하물 2PC"},{"type":"ticket","label":"TICKET","detail":"Aerobús A1 · T1 Arrivals (Floor 0) → Plaça Espanya · 24h 운행 · 편도 €7.75"},{"type":"check","label":"CHECK","detail":"출발 전 Aerobús A1 모바일 QR/비접촉 카드 및 T1 승강장 표지 확인"}],"place_ref":null},{"id":"barcelona-checkin","order":2,"start":"21:10","end":"22:00","name":"숙소 체크인 — Occidental Barcelona 1929","category":"hotel","lat":41.375274,"lng":2.147662,"summary":"체크인 및 샤워. 24시간 리셉션 운영. 익일 사그라다 QR 확인","menu":null,"reservation":null,"optional":false,"executionStatuses":[{"type":"confirmed","label":"CHECK-IN","detail":"체크인 8/29 14:00~ · 체크아웃 9/1 12:00 · 24시간 reception"}],"place_ref":null},{"id":"barcelona-sleep","order":3,"start":"22:00","end":"23:00","name":"취침 준비","category":"hotel","lat":41.375274,"lng":2.147662,"summary":"시차 적응 및 취침. 편의점 생수 구매 외 외부 관광 없음","menu":null,"reservation":null,"optional":false,"executionStatuses":[],"place_ref":null}],"legs":[{"from":"bcn-airport","to":"barcelona-checkin","mode":"bus","duration":"A1 약 25~35분 + 도보 약 5분","distance":"BCN T1→Plaça Espanya→숙소","line":"Aerobús A1","geometryStatus":"coordinate-line"},{"from":"barcelona-checkin","to":"barcelona-sleep","mode":"walk","duration":"0분","distance":"숙소 내부","line":null,"geometryStatus":"coordinate-line"}],"transport":["추천: Aerobús A1 편도 (BCN T1 도착층 승강장 ➔ Plaça d'Espanya 하차, 25~35분, 1인 €7.75 모바일 QR/비접촉 카드)","마지막 구간: Plaça d'Espanya 정류장 하차 ➔ Carrer de la Creu Coberta 방향 평지 도보 약 200m / 3~5분 ➔ Occidental Barcelona 1929 숙소 도착","대안: 심야 지연 시 24시간 Aerobús A1 또는 심야버스 NitBus N17 이용 (Plaça d'Espanya 직통)","주의: T1은 A1 탑승 (T2 전용 A2 탑승 금지). Hola Barcelona 48h 카드는 Aerobús 미적용"],"food":["기내 저녁으로 해결","필요 시 인근 편의점 물만"],"highlights":["OZ511 19:10 T1 도착 (확정)","야간 도착 — 체크인·취침만","장보기·산책은 Day 2 아침으로"],"backup":"항공 지연 시 관광 일정은 없음. Aerobús A1은 24시간 운행. 호텔은 24시간 reception이지만 심야 도착 시 예약 유지/late arrival 조건은 예약서 기준으로 확인.","map":{"zoom":12,"center":[41.345,2.125],"routeCache":null},"needsReview":["출발 전 Aerobús A1 모바일 QR과 T1 승강장 표지 재확인"],"sourceRefs":["source/CURRENT/20_Regional_Chapters/04_Barcelona_Sitges_v2.0.md#Day-1","항공권 확정 (2026-08-10 반영): OZ511 ICN T2 11:50 → BCN T1 19:10, 예약 [CONFIRMED]","source/ASSETS/75_Execution_Maps/Barcelona_Execution_Map_v0.2.kml","Aerobús 공식 노선·정류장 확인 (2026-08-22): A1은 BCN T1↔도심, Plaça Espanya 정차, 24시간 운행","예약 증빙 확인 (2026-08-21): Trip.com 바우처 대조 — Occidental Barcelona 1929 · Carrer de la Creu Coberta 20-22 · 체크인 14:00~ · 체크아웃 12:00","예약 증빙 확인 (2026-08-21): 아시아나 전자항공권 — OZ511 · 29AUG26 11:50 ICN T2 ➔ 19:10 BCN T1 · 14H20M · 무료 수하물 2PC"]}
