{
  "schemaVersion": "1.0",
  "day": 37,
  "date": "2026-10-04",
  "city": "Paris",
  "title": "개선문상 경마 대회 (Qatar Prix de l'Arc de Triomphe)",
  "sourceStatus": "authoritative",
  "prototypeType": null,
  "startTime": "09:30",
  "endTime": "20:30",
  "totalDuration": "11시간",
  "totalDistance": "메트로+셔틀 왕복 약 18km",
  "fatigue": "4",
  "hotel": {
    "name": "78 Rue de Lourmel (파리 15구)",
    "lat": 48.8472,
    "lng": 2.2894,
    "status": "confirmed",
    "address": "78 Rue de Lourmel, 75015 Paris, Île-de-France, France"
  },
  "stops": [
    {
      "id": "longchamp-transfer",
      "order": 1,
      "start": "10:30",
      "end": "11:30",
      "name": "15구 숙소 출발 ➔ 메트로/셔틀 ➔ ParisLongchamp",
      "category": "transport",
      "lat": 48.858,
      "lng": 2.234,
      "summary": "10:30 출발 ➔ 메트로 10호선 Porte d'Auteuil역 ➔ 개선문상 전용 무료 셔틀버스 탑승 ➔ 11:30 파리롱샹 경마장 도착",
      "menu": null,
      "reservation": "Qatar Prix de l'Arc 티켓 (General Admission / Grandstand)",
      "optional": false,
      "place_ref": null
    },
    {
      "id": "prix-de-l-arc",
      "order": 2,
      "start": "11:30",
      "end": "18:00",
      "name": "Qatar Prix de l'Arc de Triomphe (개선문상 본선)",
      "category": "sight",
      "lat": 48.858,
      "lng": 2.234,
      "summary": "세계 최고 권위 잔디 경마 축제. 패독(Paddock) 말 관람, 인터내셔널 푸드 트럭 빌리지 점심, 16:05 개선문상 메인 레이스(2,400m) 직관, 우승마 시상식 관람 (6.5시간)",
      "menu": "푸드빌리지 버거/샴페인, 프렌치 프라이",
      "reservation": "예약확정 Qatar Prix de l'Arc de Triomphe",
      "optional": false,
      "place_ref": null
    },
    {
      "id": "paris-return",
      "order": 3,
      "start": "18:30",
      "end": "20:30",
      "name": "파리롱샹 ➔ 15구 숙소 귀환 & 저녁",
      "category": "hotel",
      "lat": 48.8472,
      "lng": 2.2894,
      "summary": "경기 종료 후 셔틀버스 + 메트로 10호선 탑승 ➔ 15구 숙소 복귀. 15구 숙소식 저녁 식사 및 휴식",
      "menu": null,
      "reservation": null,
      "optional": false,
      "place_ref": null
    }
  ],
  "legs": [
    {
      "from": "longchamp-transfer",
      "to": "prix-de-l-arc",
      "mode": "bus",
      "duration": "셔틀버스 15분",
      "distance": "3.5km",
      "line": null,
      "geometryStatus": "coordinate-line"
    },
    {
      "from": "prix-de-l-arc",
      "to": "paris-return",
      "mode": "bus",
      "duration": "셔틀버스 + 메트로 10호선 약 40분 (인파 완충)",
      "distance": "8.5km",
      "line": null,
      "geometryStatus": "coordinate-line"
    }
  ],
  "transport": [
    "메트로 10호선 (Porte d'Auteuil역) + France Galop 공식 무료 셔틀버스(Navette)",
    "파리롱샹 경마장 보행"
  ],
  "food": [
    "경기장 식사",
    "저녁 숙소식"
  ],
  "highlights": [
    "P0 고정 스포츠 — 종일",
    "10/3–4 개최·10/4 메인 확인됨",
    "야간행사 전면 금지"
  ],
  "backup": "퇴장 시 셔틀버스 대기열 과다 시 Porte de Passy 방향 도보 15분 후 버스/우버 이용",
  "map": {
    "zoom": 12,
    "center": [
      48.849,
      2.29
    ],
    "routeCache": null
  },
  "needsReview": [
    "Prix de l'Arc 10/4 메인 레이스 시간표(16:05) 및 셔틀 운행 재확인",
    "스마트 캐주얼 드레스코드 및 가방 반입 규정 준수"
  ],
  "sourceRefs": [
    "source/CURRENT/20_Regional_Chapters/11_Paris_Long_Stay_v2.0.md#Day-11-10월4일",
    "OSM Nominatim 지오코딩 2026-08-06: Hippodrome de Longchamp"
  ]
}
